<?xml version="1.0"?>
<!DOCTYPE movies SYSTEM "movies.dtd">
<?xml-stylesheet href="movies.css" type="text/css"?>
<!-- Source: http://www.imdb.com/ -->
<movies>
     <movie id="0054215" mpa-rating="R">
          <title xml:lang="en">Psycho</title>
          <year>1960</year>
          <genre>horror</genre>
          <genre>mystery</genre>
          <genre>thriller</genre>
          <rating>8.5</rating>
          <votes>730736</votes>
     </movie>
     <movie id="0080684" mpa-rating="PG">
          <title xml:lang="en">Star Wars: Episode V - The Empire Strikes Back</title>
          <title xml:lang="hu">A Birodalom visszavág</title>
          <year>1980</year>
          <genre>action</genre>
          <genre>adventure</genre>
          <genre>fantasy</genre>
          <rating>8.7</rating>
          <votes>1402310</votes>
     </movie>
     <movie id="0468569" mpa-rating="PG-13">
          <title xml:lang="en">The Dark Knight</title>
          <title xml:lang="hu">A sötét lovag</title>
          <title xml:lang="el">Ο σκοτεινός ιππότης</title>
          <year>2008</year>
          <genre>action</genre>
          <genre>crime</genre>
          <genre>drama</genre>
          <rating>9.0</rating>
          <votes>2924774</votes>
     </movie>
     <movie id="0078748" mpa-rating="R">
          <title xml:lang="en">Alien</title>
          <title xml:lang="hu">A nyolcadik utas: a Halál</title>
          <title xml:lang="ja">エイリアン</title>
          <year>1979</year>
          <genre>horror</genre>
          <genre>sci-fi</genre>
          <rating>8.5</rating>
          <votes>981779</votes>
     </movie>
     <movie id="0071853" mpa-rating="PG">
          <title xml:lang="en">Monty Python and the Holy Grail</title>
          <title xml:lang="hu">Gyalog galopp</title>
          <title xml:lang="it">Monty Python e il Sacro Graal</title>
          <year>1975</year>
          <genre>adventure</genre>
          <genre>comedy</genre>
          <genre>fantasy</genre>
          <rating>8.2</rating>
          <votes>576812</votes>
     </movie>
     <movie id="0062622" mpa-rating="G">
          <title xml:lang="en">2001: A Space Odyssey</title>
          <title xml:lang="hu">2001: Űrodüsszeia</title>
          <title xml:lang="fr">2001, L'Odyssée de l'espace</title>
          <year>1968</year>
          <genre>sci-fi</genre>
          <rating>8.3</rating>
          <votes>731706</votes>
     </movie>
</movies>
